Disease,PMID,Sentence,Hallmark,Association,No_Association,Error,Not Clear,Sentence_decode
Macular_Degeneration,25329617,Reactive oxygen species (ROS)-mediated retinal pigment epithelium (RPE) cell apoptosis is attributed to age-related macular degeneration (AMD) pathogenesis.,MD,NA,NA,NA,NA,reactive oxygen species ros mediated retinal pigment epithelium rpe cell apoptosis is attributed to age related macular degeneration amd pathogenesis
Macular_Degeneration,19136057,"Oxidative damage from reactive oxygen species (ROS) has been implicated in many diseases, including age-related macular degeneration, in which the retinal pigment epithelium (RPE) is considered a primary target.",MD,NA,NA,NA,NA,oxidative damage from reactive oxygen species ros has been implicated in many diseases including age related macular degeneration in which the retinal pigment epithelium rpe is considered a primary target
Macular_Degeneration,7803358,Age-related macular degeneration (ARMD) may result from events initiated by reactive oxygen species.,MD,NA,NA,NA,NA,age related macular degeneration armd may result from events initiated by reactive oxygen species
Macular_Degeneration,22822904,Noninvasive imaging of mitochondrial dysfunction in dry age-related macular degeneration.,MD,NA,NA,NA,NA,noninvasive imaging of mitochondrial dysfunction in dry age related macular degeneration
Macular_Degeneration,15851580,Nuclear gene expression changes due to mitochondrial dysfunction in ARPE-19 cells: implications for age-related macular degeneration.,MD,NA,NA,NA,NA,nuclear gene expression changes due to mitochondrial dysfunction in arpe 19 cells implications for age related macular degeneration
Macular_Degeneration,23685869,"Ultraviolet (UV) radiation and reactive oxygen species (ROS) impair the physiological functions of retinal pigment epithelium (RPE) cells by inducing cell apoptosis, which is the main cause of age-related macular degeneration (AMD).",MD,NA,NA,NA,NA,ultraviolet uv radiation and reactive oxygen species ros impair the physiological functions of retinal pigment epithelium rpe cells by inducing cell apoptosis which is the main cause of age related macular degeneration amd
Menieres_Disease,23165776,Mitochondrial degeneration in the inner ear is likely a contributing factor in age-related hearing loss and other otopathologies such as Menieres disease.,MD,1,0,0,0,mitochondrial degeneration in the inner ear is likely a contributing factor in age related hearing loss and other otopathologies such as menieres disease
Motor_Neurone_Disease,20625092,Mitochondrial respiratory chain dysfunction in muscle from patients with amyotrophic lateral sclerosis.,MD,1,0,0,0,mitochondrial respiratory chain dysfunction in muscle from patients with amyotrophic lateral sclerosis
Motor_Neurone_Disease,25893255,"Mitochondrial dysfunction is implicated in amyotrophic lateral sclerosis, where the progressive degeneration of motor neurons results in muscle atrophy, paralysis and death.",MD,1,0,0,0,mitochondrial dysfunction is implicated in amyotrophic lateral sclerosis where the progressive degeneration of motor neurons results in muscle atrophy paralysis and death
Motor_Neurone_Disease,25893255,Mitochondrial dysfunction in blood cells from amyotrophic lateral sclerosis patients.,MD,1,0,0,0,mitochondrial dysfunction in blood cells from amyotrophic lateral sclerosis patients
Motor_Neurone_Disease,24616062,Mitochondrial dysfunction in the motor neuron has been suspected in amyotrophic lateral sclerosis (ALS).,MD,1,0,0,0,mitochondrial dysfunction in the motor neuron has been suspected in amyotrophic lateral sclerosis als
Motor_Neurone_Disease,25081190,"Origins of onset and progression of motor neurodegeneration in amyotrophic lateral sclerosis (ALS) are not clearly known, but may include impairment of mitochondrial bioenergetics.",MD,NA,NA,NA,NA,origins of onset and progression of motor neurodegeneration in amyotrophic lateral sclerosis als are not clearly known but may include impairment of mitochondrial bioenergetics
Motor_Neurone_Disease,10869047,"Applying flavoprotein/NAD(P)H autofluorescence imaging of mitochondrial function in saponin-permeabilized muscle fibres, we detected a heterogeneous distribution of the respiratory chain defect among individual fibres in muscle biopsies of patients (11 out of 17) with sporadic amyotrophic lateral sclerosis (SALS).",MD,NA,NA,NA,NA,applying flavoprotein nad p h autofluorescence imaging of mitochondrial function in saponin permeabilized muscle fibres we detected a heterogeneous distribution of the respiratory chain defect among individual fibres in muscle biopsies of patients 11 out of 17 with sporadic amyotrophic lateral sclerosis sals
Motor_Neurone_Disease,19379740,"We compared mitochondrial respiratory chain function, mitochondrial DNA (mtDNA) integrity, and oxidative stress levels in muscle, myoblasts, fibroblasts and cybrids, from 12 amyotrophic lateral sclerosis (ALS) patients with 28 control samples.",MD,NA,NA,NA,NA,we compared mitochondrial respiratory chain function mitochondrial dna mtdna integrity and oxidative stress levels in muscle myoblasts fibroblasts and cybrids from 12 amyotrophic lateral sclerosis als patients with 28 control samples
Motor_Neurone_Disease,16861155,"Mitochondrial disorder may mimic motor neuron disease, muscle biopsy may mimic myositis, and may show only little evidence for respiratory chain disorder.",MD,NA,NA,NA,NA,mitochondrial disorder may mimic motor neuron disease muscle biopsy may mimic myositis and may show only little evidence for respiratory chain disorder
Motor_Neurone_Disease,24709290,"Deregulation of this pathway, as it occurs in mnd2 mutant mice, causes mitochondrial dysfunction and mitophagy, and could be responsible for the motor neuron disease and the premature aging phenotype observed in these animals.",MD,NA,NA,NA,NA,deregulation of this pathway as it occurs in mnd2 mutant mice causes mitochondrial dysfunction and mitophagy and could be responsible for the motor neuron disease and the premature aging phenotype observed in these animals
Motor_Neurone_Disease,8846231,Increased iron in motor neuron disease spinal cord could act to enhance formation of reactive oxygen species.,MD,NA,NA,NA,NA,increased iron in motor neuron disease spinal cord could act to enhance formation of reactive oxygen species
Motor_Neurone_Disease,25178511,"Increased ROS has been observed in the amyotrophic lateral sclerosis (ALS) SOD1 transgenic mouse, and in this preclinical model the inactivation of NOX2 decreases ROS production and extends survival.",MD,NA,NA,NA,NA,increased ros has been observed in the amyotrophic lateral sclerosis als sod1 transgenic mouse and in this preclinical model the inactivation of nox2 decreases ros production and extends survival
Motor_Neurone_Disease,9462746,"Reactive oxygen species (ROS) have been implicated in a wide range of degenerative processes including amyotrophic lateral sclerosis, ischemic heart disease, Alzheimer disease, Parkinson disease and aging.",MD,NA,NA,NA,NA,reactive oxygen species ros have been implicated in a wide range of degenerative processes including amyotrophic lateral sclerosis ischemic heart disease alzheimer disease parkinson disease and aging
Motor_Neurone_Disease,27538669,"Since PD and two other neurodegenerative diseases, multiple system atrophy (MSA) and amyotrophic lateral sclerosis (ALS), are associated with mitochondrial dysfunction, we wanted to know whether CHCHD2 mutations may be linked to MSA and sporadic ALS in Chinese patients.",MD,NA,NA,NA,NA,since pd and two other neurodegenerative diseases multiple system atrophy msa and amyotrophic lateral sclerosis als are associated with mitochondrial dysfunction we wanted to know whether chchd2 mutations may be linked to msa and sporadic als in chinese patients
Motor_Neurone_Disease,25904686,To investigate cerebral oxidative stress based on an over-reductive state caused by mitochondrial dysfunction and its relationship to disease severity in patients with amyotrophic lateral sclerosis (ALS) using PET with [(62)Cu]diacetyl-bis(N(4)-methylthiosemicarbazone) ((62)Cu-ATSM).,MD,NA,NA,NA,NA,to investigate cerebral oxidative stress based on an over reductive state caused by mitochondrial dysfunction and its relationship to disease severity in patients with amyotrophic lateral sclerosis als using pet with 62 cu diacetyl bis n 4 methylthiosemicarbazone 62 cu atsm
Motor_Neurone_Disease,17454840,There is evidence showing impaired mitochondrial energy production and increased oxidative damage to mitochondria in amyotrophic lateral sclerosis (ALS).,MD,NA,NA,NA,NA,there is evidence showing impaired mitochondrial energy production and increased oxidative damage to mitochondria in amyotrophic lateral sclerosis als
Motor_Neurone_Disease,22975021,Skeletal muscle mitochondrial dysfunction is believed to play a role in the progression and severity of amyotrophic lateral sclerosis (ALS).,MD,NA,NA,NA,NA,skeletal muscle mitochondrial dysfunction is believed to play a role in the progression and severity of amyotrophic lateral sclerosis als
Motor_Neurone_Disease,22450425,"Several lines of evidence suggest that mitochondrial dysfunction is involved in amyotrophic lateral sclerosis (ALS), but despite the fact that mitochondria play a central role in excitotoxicity, oxidative stress, and apoptosis, the intimate underlying  mechanism linking mitochondrial defects to motor neuron degeneration in ALS still remains elusive.",MD,NA,NA,NA,NA,several lines of evidence suggest that mitochondrial dysfunction is involved in amyotrophic lateral sclerosis als but despite the fact that mitochondria play a central role in excitotoxicity oxidative stress and apoptosis the intimate underlying mechanism linking mitochondrial defects to motor neuron degeneration in als still remains elusive
Motor_Neurone_Disease,15901649,Previous findings suggested specific mitochondrial dysfunction in skeletal muscle of patients with amyotrophic lateral sclerosis (ALS).,MD,NA,NA,NA,NA,previous findings suggested specific mitochondrial dysfunction in skeletal muscle of patients with amyotrophic lateral sclerosis als
Motor_Neurone_Disease,14644702,Mitochondrial dysfunction and CoQ10 treatment was also proposed in neurodegenerative disorders as amyotrophic lateral sclerosis and Parkinsons disease.,MD,NA,NA,NA,NA,mitochondrial dysfunction and coq10 treatment was also proposed in neurodegenerative disorders as amyotrophic lateral sclerosis and parkinsons disease
Myelodysplastic_Syndrome,22117997,Reactive oxygen species (ROS) and serum ferritin levels are both considered to be important biological factors in the pathogenesis of myelodysplastic syndrome (MDS).,MD,1,0,0,0,reactive oxygen species ros and serum ferritin levels are both considered to be important biological factors in the pathogenesis of myelodysplastic syndrome mds
Myelodysplastic_Syndrome,19148135,"A large proportion (52+/-16%) of immature and mature myelodysplastic syndrome (MDS) erythroblasts contained cytoplasmic vacuoles, partly double membraned and positive for lysosomal marker LAMP-2 and mitochondrial markers, findings compatible with autophagic removal of dysfunctional mitochondria.",MD,1,0,0,0,a large proportion 52 16 of immature and mature myelodysplastic syndrome mds erythroblasts contained cytoplasmic vacuoles partly double membraned and positive for lysosomal marker lamp 2 and mitochondrial markers findings compatible with autophagic removal of dysfunctional mitochondria
Myelodysplastic_Syndrome,25968944,"Oxidative stress and mitochondrial dysfunction play a role in myelodysplastic syndrome development, diagnosis, and prognosis: A pilot study.",MD,1,0,0,0,oxidative stress and mitochondrial dysfunction play a role in myelodysplastic syndrome development diagnosis and prognosis a pilot study
Myelodysplastic_Syndrome,28571970,To assess the generation of reactive oxygen species (ROS) and the involvement of the main antioxidant pathways in low/intermediate-1-risk myelodysplastic syndromes (MDS) with iron overload (IOL).,MD,NA,NA,NA,NA,to assess the generation of reactive oxygen species ros and the involvement of the main antioxidant pathways in low intermediate 1 risk myelodysplastic syndromes mds with iron overload iol
Myelodysplastic_Syndrome,28460338,Iron overload promotes erythroid apoptosis through regulating HIF-1a/ROS signaling pathway in patients with myelodysplastic syndrome.,MD,NA,NA,NA,NA,iron overload promotes erythroid apoptosis through regulating hif 1a ros signaling pathway in patients with myelodysplastic syndrome
Myelodysplastic_Syndrome,22922528,Analysis of platelet GPVI expression and signaling in a patient with a collagen-selective defect associated with myelodysplastic syndrome (MDS) uniquely demonstrates divergent pathways leading to ROS generation and Syk phosphorylation in human platelets.,MD,NA,NA,NA,NA,analysis of platelet gpvi expression and signaling in a patient with a collagen selective defect associated with myelodysplastic syndrome mds uniquely demonstrates divergent pathways leading to ros generation and syk phosphorylation in human platelets
Myelodysplastic_Syndrome,25968944,"We hypothesized that oxidative stress and mitochondrial dysfunction may participate not only in apoptosis detected in some myelodysplastic syndrome (MDS) patients, but also in increasing proliferation in other patients.",MD,NA,NA,NA,NA,we hypothesized that oxidative stress and mitochondrial dysfunction may participate not only in apoptosis detected in some myelodysplastic syndrome mds patients but also in increasing proliferation in other patients
Myelodysplastic_Syndrome,25721834,Sideroblastic anaemia and primary adrenal insufficiency due to a mitochondrial respiratory chain disorder in the absence of mtDNA deletion.,MD,NA,NA,NA,NA,sideroblastic anaemia and primary adrenal insufficiency due to a mitochondrial respiratory chain disorder in the absence of mtdna deletion
Myocardial_Infarction,23631751,An imbalance between pro-oxidants and antioxidant systems has been suggested to be implicated in the physiopathology of acute myocardial infarction (AMI).,MD,1,0,0,0,an imbalance between pro oxidants and antioxidant systems has been suggested to be implicated in the physiopathology of acute myocardial infarction ami
Myocardial_Infarction,28946755,"Ischemic tissue damage in myocardial infarction (MI) is allied with the exaggerated production of reactive oxygen species (ROS) beyond the countering capability of chain-breaking radical scavengers, fallouts in the form of oxidatively burdened myocardial tissue.",MD,1,0,0,0,ischemic tissue damage in myocardial infarction mi is allied with the exaggerated production of reactive oxygen species ros beyond the countering capability of chain breaking radical scavengers fallouts in the form of oxidatively burdened myocardial tissue
Myocardial_Infarction,26415345,"In acute myocardial infarction (AMI), lack of oxygen delivery to myocardium leads to generation of reactive oxygen species (ROS) which play an important role in the pathogenesis of AMI.",MD,1,0,0,0,in acute myocardial infarction ami lack of oxygen delivery to myocardium leads to generation of reactive oxygen species ros which play an important role in the pathogenesis of ami
Myocardial_Infarction,22488795,The aim of the present study was to evaluate the in vitro ROS generation and inhibition of NEP activity in neutrophils obtained from healthy volunteers and from patients after acute myocardial infarction (AMI) by an aqueous extract of Oenothera paradoxa.,MD,NA,NA,NA,NA,the aim of the present study was to evaluate the in vitro ros generation and inhibition of nep activity in neutrophils obtained from healthy volunteers and from patients after acute myocardial infarction ami by an aqueous extract of oenothera paradoxa
Myocardial_Infarction,16891997,The present data show that there is a circadian variation of ROS production in leukocytes that might possibly influence the occurrence of cardiovascular incidents like myocardial infarction.,MD,NA,NA,NA,NA,the present data show that there is a circadian variation of ros production in leukocytes that might possibly influence the occurrence of cardiovascular incidents like myocardial infarction
Myocardial_Infarction,29257712,"A: absorption; ÎA: absorption difference; ABTS: 2,2-azino-di(3-ethylbenzothiazoline sulfonate); ACE: angiotensin-converting enzyme; AO: antioxidant; ARB: angiotensin receptor blocker; BMI: body mass index; CAD: coronary artery disease; CCB: calcium channel blocker; CDC: coronary heart diseases; COPD: chronic obstructive pulmonary disease; CRP: C-reactive protein; CVD: cardiovascular diseases; Cu-OOH: cumene hydroperoxide; D: dilution factor; DAN: 2,3-diaminonaphtalene; DMSO: dimethylsulfoxide; DNA: deoxyribonucleic acid; DTNB: 5,5-dithiobis(2-nitrobenzoate); Îµ: extinction coefficient; EDRF: endothelium-derived relaxing factor; fc: final concentration; GPx: glutathione peroxidases; (h)GR: (human) glutathione reductase; GSH: (reduced) glutathione; GSSG: glutathione disulfide; GST: glutathione-S-transferase; Hb: hemoglobin; HDL: high-density lipoprotein; Hk: hematocrit; H2O2: hydrogen peroxide; ICS: intensive care stay; LDH: lactate dehydrogenase; LDL: low-density lipoprotein; MI: myocardial infarction; NED: N-(1-naphthyl)-ethylendiamine-dihydrochloride; NOS: nitric oxide synthase; NOx: nitrate/nitrite; NR: nitrate reductase; PBS: phosphate buffered saline; PCA: principle component analysis; PH: pulmonary hypertension; ROS: reactive oxygen species; RNS: reactive nitrogen species; RT: room temperature (25Â°C); SA: sulfanilamide; SOD: superoxide dismutase; SSA: sulfosalicylic acid; TAC: total antioxidant capacity; TAOS: total antioxidant status; TEAC: trolox equivalent antioxidative capacity; TG: triglycerides; tGSH: total glutathione; TNB-: 2-nitro-5-thiobenzoate; U: unit; UV: ultraviolet; VA: volume activity; Wc: working concentration; WHR: waist-hip ratio.",MD,NA,NA,NA,NA,a absorption da absorption difference abts 2 2 azino di 3 ethylbenzothiazoline sulfonate ace angiotensin converting enzyme ao antioxidant arb angiotensin receptor blocker bmi body mass index cad coronary artery disease ccb calcium channel blocker cdc coronary heart diseases copd chronic obstructive pulmonary disease crp c reactive protein cvd cardiovascular diseases cu ooh cumene hydroperoxide d dilution factor dan 2 3 diaminonaphtalene dmso dimethylsulfoxide dna deoxyribonucleic acid dtnb 5 5 dithiobis 2 nitrobenzoate e extinction coefficient edrf endothelium derived relaxing factor fc final concentration gpx glutathione peroxidases h gr human glutathione reductase gsh reduced glutathione gssg glutathione disulfide gst glutathione s transferase hb hemoglobin hdl high density lipoprotein hk hematocrit h2o2 hydrogen peroxide ics intensive care stay ldh lactate dehydrogenase ldl low density lipoprotein mi myocardial infarction ned n 1 naphthyl ethylendiamine dihydrochloride nos nitric oxide synthase nox nitrate nitrite nr nitrate reductase pbs phosphate buffered saline pca principle component analysis ph pulmonary hypertension ros reactive oxygen species rns reactive nitrogen species rt room temperature 25degc sa sulfanilamide sod superoxide dismutase ssa sulfosalicylic acid tac total antioxidant capacity taos total antioxidant status teac trolox equivalent antioxidative capacity tg triglycerides tgsh total glutathione tnb 2 nitro 5 thiobenzoate u unit uv ultraviolet va volume activity wc working concentration whr waist hip ratio
Myocardial_Infarction,27216220,"To clarify the relation between oxidative stress, diabetes mellitus (DM), and acute myocardial infarction (AMI), we evaluated and compared time-specific oxidative stress after AMI in patients with and without DM by simple measurement of derivatives of reactive oxygen metabolites (d-ROMs) levels as indices of reactive oxygen species production.",MD,NA,NA,NA,NA,to clarify the relation between oxidative stress diabetes mellitus dm and acute myocardial infarction ami we evaluated and compared time specific oxidative stress after ami in patients with and without dm by simple measurement of derivatives of reactive oxygen metabolites d roms levels as indices of reactive oxygen species production
Myocardial_Infarction,24303736,There is evidence that acute myocardial infarction (AMI) is associated with increasing production of reactive oxygen species and tissue injury.,MD,NA,NA,NA,NA,there is evidence that acute myocardial infarction ami is associated with increasing production of reactive oxygen species and tissue injury
Myocardial_Infarction,23056349,"The level of C3256T heteroplasmy of mitochondrial genome in human white blood cells is a biomarker of mitochondrial dysfunction and risk factor for atherosclerosis; therefore, it can be used as an informative marker of genetic susceptibility to atherosclerosis, coronary heart disease and myocardial infarction.",MD,NA,NA,NA,NA,the level of c3256t heteroplasmy of mitochondrial genome in human white blood cells is a biomarker of mitochondrial dysfunction and risk factor for atherosclerosis therefore it can be used as an informative marker of genetic susceptibility to atherosclerosis coronary heart disease and myocardial infarction
Myocardial_Infarction,22488795,Ex vivo effects of an Oenothera paradoxa extract on the reactive oxygen species generation and neutral endopeptidase activity in neutrophils from patients after acute myocardial infarction.,MD,NA,NA,NA,NA,ex vivo effects of an oenothera paradoxa extract on the reactive oxygen species generation and neutral endopeptidase activity in neutrophils from patients after acute myocardial infarction
Myocardial_Infarction,15459610,Nicorandil improves cardiac function and clinical outcome in patients with acute myocardial infarction undergoing primary percutaneous coronary intervention: role of inhibitory effect on reactive oxygen species formation.,MD,NA,NA,NA,NA,nicorandil improves cardiac function and clinical outcome in patients with acute myocardial infarction undergoing primary percutaneous coronary intervention role of inhibitory effect on reactive oxygen species formation
Myocardial_Infarction,10614835,"Time course of free radical production after primary coronary angioplasty for acute myocardial infarction and the effect of vitamin C. Reactive oxygen species are thought to mediate reperfusion injury after rapid revascularization for acute myocardial infarction (AMI) and 8-epi prostaglandin (PG) F2alpha, a free-radical catalyzed product of arachidonic acid, has been proposed as an indicator of oxidative stress in vivo during myocardial reperfusion.",MD,NA,NA,NA,NA,time course of free radical production after primary coronary angioplasty for acute myocardial infarction and the effect of vitamin c reactive oxygen species are thought to mediate reperfusion injury after rapid revascularization for acute myocardial infarction ami and 8 epi prostaglandin pg f2alpha a free radical catalyzed product of arachidonic acid has been proposed as an indicator of oxidative stress in vivo during myocardial reperfusion
Myocardial_Infarction,25831998,"Elevated neutrophil counts were a strong and independent predictor for pro-oxidant HDL with an odds ratio per standard deviation of 1.50 (95â%CI 1.11-2.03, p=0.008), as was history of prior acute myocardial infarction, elevated triglycerides levels and reduced glomerular filtration rate.",MD,NA,NA,NA,NA,elevated neutrophil counts were a strong and independent predictor for pro oxidant hdl with an odds ratio per standard deviation of 1 50 95 ci 1 11 2 03 p 0 008 as was history of prior acute myocardial infarction elevated triglycerides levels and reduced glomerular filtration rate
Myocardial_Infarction,20947086,The current study was designed to validate the new free oxygen radicals test (FORT) and to investigate the potential relationships between ROS and clinical or biological factors in male patients with acute myocardial infarction (AMI).,MD,NA,NA,NA,NA,the current study was designed to validate the new free oxygen radicals test fort and to investigate the potential relationships between ros and clinical or biological factors in male patients with acute myocardial infarction ami
Myocardial_Infarction,20947086,The free oxygen radicals test (FORT) to assess circulating oxidative stress in patients with acute myocardial infarction.,MD,NA,NA,NA,NA,the free oxygen radicals test fort to assess circulating oxidative stress in patients with acute myocardial infarction
Myocardial_Infarction,27799252,"In contrast to cardiomyocyte necrosis, which can be quantified by cardiac troponin, functional cardiomyocyte impairment, including mitochondrial dysfunction, has escaped clinical recognition in acute myocardial infarction (AMI) patients.",MD,NA,NA,NA,NA,in contrast to cardiomyocyte necrosis which can be quantified by cardiac troponin functional cardiomyocyte impairment including mitochondrial dysfunction has escaped clinical recognition in acute myocardial infarction ami patients
Myocardial_Infarction,24267257,Platelet and leukocyte ROS production and lipoperoxidation are associated with high platelet reactivity in Non-ST elevation myocardial infarction (NSTEMI) patients on dual antiplatelet treatment.,MD,NA,NA,NA,NA,platelet and leukocyte ros production and lipoperoxidation are associated with high platelet reactivity in non st elevation myocardial infarction nstemi patients on dual antiplatelet treatment
