Disease,PMID,Sentence,Hallmark,Association,No_Association,Error,Not Clear,Sentence_decode
Primary_Malignancy_Kidney,7523311,"To study the possible involvement of reactive oxygen species (ROS) in the tumor biology of human renal-cell carcinoma (RCC), we analyzed 35 cases of RCC for 2 parameters of oxidative damage: 8-hydroxy-2-deoxyguanosine (8-OHdG), a mutation-prone DNA-base-modified product, was measured by means of high-performance liquid chromatography (HPLC) with an electrochemical (EC) detector, and 4-hydroxy-2-nonenal (HNE)-modified proteins were measured with a polyclonal antibody against HNE-modified proteins.",MD,0,0,0,1,to study the possible involvement of reactive oxygen species ros in the tumor biology of human renal cell carcinoma rcc we analyzed 35 cases of rcc for 2 parameters of oxidative damage 8 hydroxy 2 deoxyguanosine 8 ohdg a mutation prone dna base modified product was measured by means of high performance liquid chromatography hplc with an electrochemical ec detector and 4 hydroxy 2 nonenal hne modified proteins were measured with a polyclonal antibody against hne modified proteins
Primary_Malignancy_Kidney,22335872,"Significantly increased reactive oxygen species and nitric oxide, and decreased glutathione were observed in patients with renal cell carcinoma compared to normal subjects and in patients with benign tumors.",MD,1,0,0,0,significantly increased reactive oxygen species and nitric oxide and decreased glutathione were observed in patients with renal cell carcinoma compared to normal subjects and in patients with benign tumors
Primary_Malignancy_Liver,26985767,High leukocyte mtDNA content contributes to poor prognosis through ROS-mediated immunosuppression in hepatocellular carcinoma patients.,MD,1,0,0,0,high leukocyte mtdna content contributes to poor prognosis through ros mediated immunosuppression in hepatocellular carcinoma patients
Primary_Malignancy_Liver,17987802,Reactive oxygen species damaged human serum albumin in patients with hepatocellular carcinoma.,MD,1,0,0,0,reactive oxygen species damaged human serum albumin in patients with hepatocellular carcinoma
Primary_Malignancy_Liver,18801366,Epigenetic changes induced by reactive oxygen species in hepatocellular carcinoma: methylation of the E-cadherin promoter.,MD,1,0,0,0,epigenetic changes induced by reactive oxygen species in hepatocellular carcinoma methylation of the e cadherin promoter
Primary_Malignancy_Liver,27010918,Cytotoxic effect of attenuated Leishmania on liver cancer cells by inducing ROS generation.,MD,NA,NA,NA,NA,cytotoxic effect of attenuated leishmania on liver cancer cells by inducing ros generation
Primary_Malignancy_Liver,26169728,The development and progression of liver cancer are characterized by increased levels of reactive oxygen species (ROS).,MD,NA,NA,NA,NA,the development and progression of liver cancer are characterized by increased levels of reactive oxygen species ros
Primary_Malignancy_Liver,24684482,"In this study, we observed that Notch1 and ROS cooperatively increase the levels of Snail protein in Huh7 (hepatoma) cells.",MD,NA,NA,NA,NA,in this study we observed that notch1 and ros cooperatively increase the levels of snail protein in huh7 hepatoma cells
Primary_Malignancy_Liver,25346526,"Up-regulation of RORÎ± in glutamine-deficient hepatoma cells resulted from an increase in the level of cellular reactive oxygen species and in the nicotinamide adenine dinucleotide phosphate/nicotinamide adenine dinucleotide phosphate reduced (NADP+ /NADPH) ratio, which was consistent with a reduction in the glutathione/glutathione disulfide (GSH/GSSG) ratio.",MD,NA,NA,NA,NA,up regulation of rora in glutamine deficient hepatoma cells resulted from an increase in the level of cellular reactive oxygen species and in the nicotinamide adenine dinucleotide phosphate nicotinamide adenine dinucleotide phosphate reduced nadp nadph ratio which was consistent with a reduction in the glutathione glutathione disulfide gsh gssg ratio
Primary_Malignancy_Liver,27108801,"Dual oxidaseÂ 1 (DUOX1), which is the main source of reactive oxygen species (ROS) production in the airway, can be silenced in human lung cancer and hepatocellular carcinomas.",MD,NA,NA,NA,NA,dual oxidase 1 duox1 which is the main source of reactive oxygen species ros production in the airway can be silenced in human lung cancer and hepatocellular carcinomas
Primary_Malignancy_Liver,27081083,SIRT1 facilitates hepatocellular carcinoma metastasis by promoting PGC-1Î±-mediated mitochondrial biogenesis.,MD,NA,NA,NA,NA,sirt1 facilitates hepatocellular carcinoma metastasis by promoting pgc 1a mediated mitochondrial biogenesis
Primary_Malignancy_Liver,27821605,"Purpose: This phase I/II single-arm study evaluated the safety, pharmacokinetics, pharmacodynamics, and activity of foretinib, an oral multikinase inhibitor of MET, ROS, RON, AXL, TIE-2, and VEGFR2, in the first-line setting in advanced hepatocellular carcinoma patients.Experimental Design: In the phase I part, advanced hepatocellular carcinoma patients were dose escalated on foretinib (30-60 mg) every day using the standard 3+3 design.",MD,NA,NA,NA,NA,purpose this phase i ii single arm study evaluated the safety pharmacokinetics pharmacodynamics and activity of foretinib an oral multikinase inhibitor of met ros ron axl tie 2 and vegfr2 in the first line setting in advanced hepatocellular carcinoma patients experimental design in the phase i part advanced hepatocellular carcinoma patients were dose escalated on foretinib 30 60 mg every day using the standard 3 3 design
Primary_Malignancy_Liver,27221474,"In this study, we showed that GSK-3Î² inhibits ROS-induced hepatocellular carcinoma cell death by suppressing ASK1.",MD,NA,NA,NA,NA,in this study we showed that gsk 3b inhibits ros induced hepatocellular carcinoma cell death by suppressing ask1
Primary_Malignancy_Liver,27221474,Glycogen synthase kinase-3Î² antagonizes ROS-induced hepatocellular carcinoma cell death through suppression of the apoptosis signal-regulating kinase 1.,MD,NA,NA,NA,NA,glycogen synthase kinase 3b antagonizes ros induced hepatocellular carcinoma cell death through suppression of the apoptosis signal regulating kinase 1
Primary_Malignancy_Liver,24684482,"Notably, Notch1 expression is upregulated in 41.8% of hepatocellular carcinoma (HCC) patients and ROS levels increases as HCC progresses from Grade I to Grade III.",MD,NA,NA,NA,NA,notably notch1 expression is upregulated in 41 8 of hepatocellular carcinoma hcc patients and ros levels increases as hcc progresses from grade i to grade iii
Primary_Malignancy_Liver,22092473,This state increases circulating ROS levels and may affect hepatocellular carcinoma (HCC).,MD,NA,NA,NA,NA,this state increases circulating ros levels and may affect hepatocellular carcinoma hcc
Primary_Malignancy_Liver,17987802,The role of reactive oxygen species (ROS) damaged human serum albumin (HSA) in hepatocellular carcinoma (HCC) has been investigated in the present study.,MD,NA,NA,NA,NA,the role of reactive oxygen species ros damaged human serum albumin hsa in hepatocellular carcinoma hcc has been investigated in the present study
Primary_Malignancy_Liver,22902857,Sorafenib-induced hepatocellular carcinoma cell death depends on reactive oxygen species production in vitro and in vivo.,MD,NA,NA,NA,NA,sorafenib induced hepatocellular carcinoma cell death depends on reactive oxygen species production in vitro and in vivo
Primary_Malignancy_Liver,22996042,"Through degrading SQSTM1, decreasing SQSTM1 aggregates, and therefore interrupting the positive feedback between SQSTM1 aggregates and ROS production, autophagy plays a protective role against hepatocellular carcinoma.",MD,NA,NA,NA,NA,through degrading sqstm1 decreasing sqstm1 aggregates and therefore interrupting the positive feedback between sqstm1 aggregates and ros production autophagy plays a protective role against hepatocellular carcinoma
Primary_Malignancy_Liver,24752601,Reactive oxygen species generation is essential for cisplatin-induced accelerated senescence in hepatocellular carcinoma.,MD,NA,NA,NA,NA,reactive oxygen species generation is essential for cisplatin induced accelerated senescence in hepatocellular carcinoma
Primary_Malignancy_Liver,25683165,Here we report that the upregulation of SIRT6 expression was required for transforming growth factor (TGF)-Î²1 and H2O2/HOCl reactive oxygen species (ROS) to promote the tumorigenicity of hepatocellular carcinoma (HCC) cells.,MD,NA,NA,NA,NA,here we report that the upregulation of sirt6 expression was required for transforming growth factor tgf b1 and h2o2 hocl reactive oxygen species ros to promote the tumorigenicity of hepatocellular carcinoma hcc cells
Primary_Malignancy_Liver,27282266,"Nicotinamide adenine dinucleotide phosphate oxidase (NOX)-mediated reactive oxygen species contribute to various liver diseases, including hepatocellular carcinoma (HCC).",MD,NA,NA,NA,NA,nicotinamide adenine dinucleotide phosphate oxidase nox mediated reactive oxygen species contribute to various liver diseases including hepatocellular carcinoma hcc
Primary_Malignancy_Liver,18801366,"We sought to determine whether ROS promote hypermethylation of the promoter region of E-cadherin, a regulator of the epithelial-to-mesenchymal transition, in hepatocellular carcinoma (HCC) cells.",MD,NA,NA,NA,NA,we sought to determine whether ros promote hypermethylation of the promoter region of e cadherin a regulator of the epithelial to mesenchymal transition in hepatocellular carcinoma hcc cells
Primary_Malignancy_Liver,24684482,Notch1 increases Snail expression under high reactive oxygen species conditions in hepatocellular carcinoma cells.,MD,NA,NA,NA,NA,notch1 increases snail expression under high reactive oxygen species conditions in hepatocellular carcinoma cells
Primary_Malignancy_Lung,22393988,"Continue cigarette smoke exposure may increase production of ROS and bring about a reduction of MnSOD, which could play a role in lung cancer development.",MD,1,0,0,0,continue cigarette smoke exposure may increase production of ros and bring about a reduction of mnsod which could play a role in lung cancer development
Primary_Malignancy_Lung,27941873,"Mitochondrial dynamics has been implicated in malignant properties of cells, particularly metastasis that is the major cause of death in patients diagnosed with cancer including lung cancer.",MD,1,0,0,0,mitochondrial dynamics has been implicated in malignant properties of cells particularly metastasis that is the major cause of death in patients diagnosed with cancer including lung cancer
Primary_Malignancy_Lung,10955757,"Also, the oxidative modification of nucleic acids by reactive oxygen species is of remarkable biological importance as it may contribute to malignant conversion, but its exact role in lung cancer biology is still not clear.",MD,1,0,0,0,also the oxidative modification of nucleic acids by reactive oxygen species is of remarkable biological importance as it may contribute to malignant conversion but its exact role in lung cancer biology is still not clear
Primary_Malignancy_Lung,23533664,"Together, these findings demonstrate that low dose RV treatment inhibits lung cancer cell growth via a previously unappreciated mechanism, namely the induction of premature senescence through ROS-mediated DNA damage.",MD,NA,NA,NA,NA,together these findings demonstrate that low dose rv treatment inhibits lung cancer cell growth via a previously unappreciated mechanism namely the induction of premature senescence through ros mediated dna damage
Primary_Malignancy_Lung,23533664,"Mechanistically, RV-induced premature senescence correlates with increased DNA double strand breaks (DSBs) and reactive oxygen species (ROS) production in lung cancer cells.",MD,NA,NA,NA,NA,mechanistically rv induced premature senescence correlates with increased dna double strand breaks dsbs and reactive oxygen species ros production in lung cancer cells
Primary_Malignancy_Lung,27108801,"Dual oxidaseÂ 1 (DUOX1), which is the main source of reactive oxygen species (ROS) production in the airway, can be silenced in human lung cancer and hepatocellular carcinomas.",MD,NA,NA,NA,NA,dual oxidase 1 duox1 which is the main source of reactive oxygen species ros production in the airway can be silenced in human lung cancer and hepatocellular carcinomas
Primary_Malignancy_Lung,28121949,Reactive oxygen species modulator 1 (Romo1) as a novel diagnostic marker for lung cancer-related malignant effusion.,MD,NA,NA,NA,NA,reactive oxygen species modulator 1 romo1 as a novel diagnostic marker for lung cancer related malignant effusion
Primary_Malignancy_Lung,11731445,"In this context, cigarette smoke exposure, the primary risk factor in lung cancer development, leads to high levels of ROS within the human airway.",MD,NA,NA,NA,NA,in this context cigarette smoke exposure the primary risk factor in lung cancer development leads to high levels of ros within the human airway
Primary_Malignancy_Lung,17982639,"Our data support that the simultaneous determination of ROS, GSH, vitamin E, together with TNF-alpha allows the identification of a lung cancer patient developing cancer-related cachexia.",MD,NA,NA,NA,NA,our data support that the simultaneous determination of ros gsh vitamin e together with tnf alpha allows the identification of a lung cancer patient developing cancer related cachexia
Primary_Malignancy_Lung,22363619,"Given that the common and ""non-pathological"" mtDNA variations determine differences in oxidative phosphorylation performance and ROS production, an important determinant of lung cancer risk, we hypothesize that the mtDNA variations may play roles in lung cancer risk.",MD,NA,NA,NA,NA,given that the common and non pathological mtdna variations determine differences in oxidative phosphorylation performance and ros production an important determinant of lung cancer risk we hypothesize that the mtdna variations may play roles in lung cancer risk
Primary_Malignancy_Lung,23533664,Resveratrol induces premature senescence in lung cancer cells via ROS-mediated DNA damage.,MD,NA,NA,NA,NA,resveratrol induces premature senescence in lung cancer cells via ros mediated dna damage
Primary_Malignancy_Lung,23533664,"Furthermore, we show that RV treatment markedly induces NAPDH oxidase-5 (Nox5) expression in both A549 and H460 cells, suggesting that RV may increase ROS generation in lung cancer cells through upregulating Nox5 expression.",MD,NA,NA,NA,NA,furthermore we show that rv treatment markedly induces napdh oxidase 5 nox5 expression in both a549 and h460 cells suggesting that rv may increase ros generation in lung cancer cells through upregulating nox5 expression
Primary_Malignancy_Lung,23919722,Neutrophils produced higher amounts of ROS in patients with lung cancer with or without COPD compared with COPD patients or healthy individuals (P < 0.05).,MD,NA,NA,NA,NA,neutrophils produced higher amounts of ros in patients with lung cancer with or without copd compared with copd patients or healthy individuals p 0 05
Primary_Malignancy_Lung,27286259,"Further, TLR4 activation in primary human lung cancer cells increased their ROS levels.",MD,NA,NA,NA,NA,further tlr4 activation in primary human lung cancer cells increased their ros levels
Primary_Malignancy_Lung,24141489,"Collectively, these results demonstrate that RV-induced radiosensitization is associated with significant increase of ROS production, DNA-DSBs and senescence induction in irradiated NSCLC cells, suggesting that RV treatment may sensitize lung cancer cells to radiotherapy via enhancing IR-induced premature senescence.",MD,NA,NA,NA,NA,collectively these results demonstrate that rv induced radiosensitization is associated with significant increase of ros production dna dsbs and senescence induction in irradiated nsclc cells suggesting that rv treatment may sensitize lung cancer cells to radiotherapy via enhancing ir induced premature senescence
Primary_Malignancy_Lung,25463045,"STC2 knockdown also attenuated the H202-induced oxidative stress on H460 cell viability with a subsequent increase in intracellular ROS levels, which suggest a protective role of STC2 in redox regulatory system of lung cancer.",MD,NA,NA,NA,NA,stc2 knockdown also attenuated the h202 induced oxidative stress on h460 cell viability with a subsequent increase in intracellular ros levels which suggest a protective role of stc2 in redox regulatory system of lung cancer
Primary_Malignancy_Lung,26549498,"Our results showed that overexpression of Fra-1 in the lung cancer H460 cells, led to an increase in ÎÎ¨m and and a decrease in intracellular ROS and Ca2+ concentrations.",MD,NA,NA,NA,NA,our results showed that overexpression of fra 1 in the lung cancer h460 cells led to an increase in dpsm and and a decrease in intracellular ros and ca2 concentrations
Primary_Malignancy_Lung,27286259,TLR4/ROS/miRNA-21 pathway underlies lipopolysaccharide instructed primary tumor outgrowth in lung cancer patients.,MD,NA,NA,NA,NA,tlr4 ros mirna 21 pathway underlies lipopolysaccharide instructed primary tumor outgrowth in lung cancer patients
Primary_Malignancy_Lung,22750558,We investigated the NF-ÎºB-dependent effects and mechanism underlying reactive oxygen species (ROS)-mediated DDR outcomes of normal human lung fibroblasts (HDFs) and A549 human lung cancer epithelial cells.,MD,NA,NA,NA,NA,we investigated the nf kb dependent effects and mechanism underlying reactive oxygen species ros mediated ddr outcomes of normal human lung fibroblasts hdfs and a549 human lung cancer epithelial cells
Primary_Malignancy_Lung,27286259,Scavenge of ROS abrogated the up-regulation of miR-21 in primary human lung cancer cells and attenuated LPS-induced outgrowth.,MD,NA,NA,NA,NA,scavenge of ros abrogated the up regulation of mir 21 in primary human lung cancer cells and attenuated lps induced outgrowth
Primary_Malignancy_Lung,27286259,"For in vivo relevance, expression of TLR4 was correlated with miR-21 expression and ROS production in freshly isolated, untreated primary human lung cancer cells.",MD,NA,NA,NA,NA,for in vivo relevance expression of tlr4 was correlated with mir 21 expression and ros production in freshly isolated untreated primary human lung cancer cells
Primary_Malignancy_Lung,27286259,These findings demonstrate an essential role of TLR4/ROS/miR-21 pathway in LPS-induced outgrowth of primary human lung cancer.,MD,NA,NA,NA,NA,these findings demonstrate an essential role of tlr4 ros mir 21 pathway in lps induced outgrowth of primary human lung cancer
Primary_Malignancy_Lung,21744875,"These changes were found to be present at initial disease stages and could be related to known cancer biochemical hallmarks, such as enhanced glycolysis, glutaminolysis, and gluconeogenesis, together with suppressed Krebs cycle and reduced lipid catabolism, thus supporting the hypothesis of a systemic metabolic signature for lung cancer.",MD,NA,NA,NA,NA,these changes were found to be present at initial disease stages and could be related to known cancer biochemical hallmarks such as enhanced glycolysis glutaminolysis and gluconeogenesis together with suppressed krebs cycle and reduced lipid catabolism thus supporting the hypothesis of a systemic metabolic signature for lung cancer
Primary_Malignancy_Lung,27179848,"The presence of ROS proto-oncogene 1, receptor tyrosine kinase gene (ROS1) rearrangements in lung cancers confers sensitivity to ROS kinase inhibitors, including crizotinib.",MD,NA,NA,NA,NA,the presence of ros proto oncogene 1 receptor tyrosine kinase gene ros1 rearrangements in lung cancers confers sensitivity to ros kinase inhibitors including crizotinib
Primary_Malignancy_Lung,24141489,"Furthermore, our investigation show that inhibition of ROS production by N-acetyl-cysteine attenuates RV-induced radiosensitization in lung cancer cells.",MD,NA,NA,NA,NA,furthermore our investigation show that inhibition of ros production by n acetyl cysteine attenuates rv induced radiosensitization in lung cancer cells
Primary_Malignancy_Lung,19637646,The role of reactive oxygen species (ROS)-damaged human serum albumin (HSA) in lung cancer (LC) patients is investigated.,MD,NA,NA,NA,NA,the role of reactive oxygen species ros damaged human serum albumin hsa in lung cancer lc patients is investigated
Primary_Malignancy_Lung,25115457,Hecogenin acetate inhibits reactive oxygen species production and induces cell cycle arrest and senescence in the A549 human lung cancer cell line.,MD,NA,NA,NA,NA,hecogenin acetate inhibits reactive oxygen species production and induces cell cycle arrest and senescence in the a549 human lung cancer cell line
Primary_Malignancy_Lung,11499296,"The oxidative modification of nucleic acids by reactive oxygen species may lead to malignant conversion, but its exact role in lung cancer biology is still not clear.",MD,NA,NA,NA,NA,the oxidative modification of nucleic acids by reactive oxygen species may lead to malignant conversion but its exact role in lung cancer biology is still not clear
Primary_Malignancy_Lung,26469915,"We aimed to identify the clinicoradiologic predictors of tumors with ALK (anaplastic lymphoma kinase), ROS1 (c-ros oncogene 1), or RET (rearranged during transfection) fusions in patients with lung adenocarcinoma.A total of 539 pathologically confirmed lung adenocarcinomas were included in this retrospective study.",MD,NA,NA,NA,NA,we aimed to identify the clinicoradiologic predictors of tumors with alk anaplastic lymphoma kinase ros1 c ros oncogene 1 or ret rearranged during transfection fusions in patients with lung adenocarcinoma a total of 539 pathologically confirmed lung adenocarcinomas were included in this retrospective study
Primary_Malignancy_Lung,26851496,"DNA extracted from lung adenocarcinoma specimens collected from 157 patients in whom primary lung adenocarcinoma was diagnosed from 2013 to 2015 in the University Hospital of Martinique was tested for mutation of the epidermal growth factor receptor gene (EGFR), Kirsten rat sarcoma viral oncogene homolog gene (KRAS), B-Raf proto-oncogene, serine/threonine kinase gene (BRAF), phosphatidylinositol-4,5-bisphosphate 3-kinase catalytic subunit alpha gene (PIK3CA), ROS proto-oncogene 1, receptor tyrosine kinase gene (ROS), and MMNG HOS Transforming gene (MET).",MD,NA,NA,NA,NA,dna extracted from lung adenocarcinoma specimens collected from 157 patients in whom primary lung adenocarcinoma was diagnosed from 2013 to 2015 in the university hospital of martinique was tested for mutation of the epidermal growth factor receptor gene egfr kirsten rat sarcoma viral oncogene homolog gene kras b raf proto oncogene serine threonine kinase gene braf phosphatidylinositol 4 5 bisphosphate 3 kinase catalytic subunit alpha gene pik3ca ros proto oncogene 1 receptor tyrosine kinase gene ros and mmng hos transforming gene met
Primary_Malignancy_Lung,27094798,"The efficacy of pemetrexed-based chemotherapy in patients with advanced lung adenocarcinoma with novel ROS proto-oncogene 1, receptor tyrosine kinase gene (ROS1) oncogenic rearrangement is unclear.",MD,NA,NA,NA,NA,the efficacy of pemetrexed based chemotherapy in patients with advanced lung adenocarcinoma with novel ros proto oncogene 1 receptor tyrosine kinase gene ros1 oncogenic rearrangement is unclear
Primary_Malignancy_Lung,28324883,"We examined lung adenocarcinoma patients for mutations and amplification status of epidermal growth factor receptor (EGFR), anaplastic lymphoma kinase (ALK), ROS, MET.",MD,NA,NA,NA,NA,we examined lung adenocarcinoma patients for mutations and amplification status of epidermal growth factor receptor egfr anaplastic lymphoma kinase alk ros met
Primary_Malignancy_Lung,18194082,"In this study, our aim was to investigate the levels of 8-hydroxy-2-deoxyguanosine (8OHdG) and malondialdehyde as a marker for the effects of reactive oxygen species on DNA and lipids, the levels of antioxidant vitamins and the correlations between these oxidative stress markers and antioxidants in lung cancer.",MD,NA,NA,NA,NA,in this study our aim was to investigate the levels of 8 hydroxy 2 deoxyguanosine 8ohdg and malondialdehyde as a marker for the effects of reactive oxygen species on dna and lipids the levels of antioxidant vitamins and the correlations between these oxidative stress markers and antioxidants in lung cancer
Primary_Malignancy_Lung,29251734,"Detection of anaplastic lymphoma kinase (ALK), ROS proto-oncogene 1 (ROS1), and rearranged during transfection (RET) gene rearrangements in lung adenocarcinoma is usually performed by immunohistochemistry (IHC) screening followed by fluorescence in situ hybridization (FISH), which is an expensive and difficult technique.",MD,NA,NA,NA,NA,detection of anaplastic lymphoma kinase alk ros proto oncogene 1 ros1 and rearranged during transfection ret gene rearrangements in lung adenocarcinoma is usually performed by immunohistochemistry ihc screening followed by fluorescence in situ hybridization fish which is an expensive and difficult technique
Primary_Malignancy_Lung,15355891,"The proapoptotic protein apoptosis protein activating factor-1 (Apaf-1), which is normally located in the cytoplasm, can translocate to the nucleus before non-small cell lung carcinoma (NSCLC) cells manifest signs of apoptosis such as mitochondrial damage, caspase activation, or chromatin condensation.",MD,NA,NA,NA,NA,the proapoptotic protein apoptosis protein activating factor 1 apaf 1 which is normally located in the cytoplasm can translocate to the nucleus before non small cell lung carcinoma nsclc cells manifest signs of apoptosis such as mitochondrial damage caspase activation or chromatin condensation
