Disease,PMID,Sentence,Hallmark,Association,No_Association,Error,Not Clear,Sentence_decode
Diabetes_Mellitus_other_or_not_specified,15529632,"Catalase is one of antioxidative factors involved in elimination of ROS In this study, the plasma level of lipid peroxides and plasma catalase activity in 315 patients with diabetes mellitus were assayed.",MD,NA,NA,NA,NA,catalase is one of antioxidative factors involved in elimination of ros in this study the plasma level of lipid peroxides and plasma catalase activity in 315 patients with diabetes mellitus were assayed
Diabetes_Mellitus_other_or_not_specified,25710801,"The primary goals were to re-examine whether sevelamer carbonate (SC) reduces advanced glycation end products (AGEs) (methylglyoxal and carboxymethyllysine [CML]), increases antioxidant defenses, reduces pro-oxidants, and improves hemoglobin A1c (HbA1c) in patients with type 2 diabetes mellitus (T2DM) and diabetic kidney disease (DKD).",MD,NA,NA,NA,NA,the primary goals were to re examine whether sevelamer carbonate sc reduces advanced glycation end products ages methylglyoxal and carboxymethyllysine cml increases antioxidant defenses reduces pro oxidants and improves hemoglobin a1c hba1c in patients with type 2 diabetes mellitus t2dm and diabetic kidney disease dkd
Diabetes_Mellitus_other_or_not_specified,27216220,"To clarify the relation between oxidative stress, diabetes mellitus (DM), and acute myocardial infarction (AMI), we evaluated and compared time-specific oxidative stress after AMI in patients with and without DM by simple measurement of derivatives of reactive oxygen metabolites (d-ROMs) levels as indices of reactive oxygen species production.",MD,NA,NA,NA,NA,to clarify the relation between oxidative stress diabetes mellitus dm and acute myocardial infarction ami we evaluated and compared time specific oxidative stress after ami in patients with and without dm by simple measurement of derivatives of reactive oxygen metabolites d roms levels as indices of reactive oxygen species production
Diabetes_Mellitus_other_or_not_specified,23378723,"Role of N-Îµ- carboxy methyl lysine, advanced glycation end products and reactive oxygen species for the development of nonproliferative and proliferative retinopathy in type 2 diabetes mellitus.",MD,NA,NA,NA,NA,role of n e carboxy methyl lysine advanced glycation end products and reactive oxygen species for the development of nonproliferative and proliferative retinopathy in type 2 diabetes mellitus
Diabetes_Mellitus_other_or_not_specified,26351856,"The presence of reactive oxygen species in large concentrations and for long periods is associated with the occurrence of various diseases, including type 2 diabetes mellitus.",MD,NA,NA,NA,NA,the presence of reactive oxygen species in large concentrations and for long periods is associated with the occurrence of various diseases including type 2 diabetes mellitus
Diabetes_Mellitus_other_or_not_specified,22718504,"Experimental evidences suggest that hyperglycaemia-induced overproduction of reactive oxygen species and subsequent damage to proteins, lipids and DNA may play a key role in the development of distal symmetric polyneuropathy (DSPN)-the most common complication of diabetes mellitus.",MD,NA,NA,NA,NA,experimental evidences suggest that hyperglycaemia induced overproduction of reactive oxygen species and subsequent damage to proteins lipids and dna may play a key role in the development of distal symmetric polyneuropathy dspn the most common complication of diabetes mellitus
Diabetes_Mellitus_other_or_not_specified,26519687,"Comparative histology, electron microscopy, morphometry for cell volume composition and myocardial fibrosis, reactive oxygen species (ROS), polymerase chain reaction for cardiotropic viruses, immunohistochemistry for nitrotyrosine, inducible nitric oxide synthase (iNOS), 8-hydroxydeoxyguanosine (8-OH-dG) and proteomics have been evaluated in endomyocardial biopsies from 9 patients (pts) (5 male and 4 female, mean age 61 Â± 13 years) with DbCM (left ventricular end-diastolic diameter 65 Â± 2.3mm; ejection fraction 27 Â± 6) and type 2 diabetes mellitus and 9 pts with IDCM (mean age 60 Â± 9 years) matched for sex, age and severity of left ventricular (LV) dysfunction.",MD,NA,NA,NA,NA,comparative histology electron microscopy morphometry for cell volume composition and myocardial fibrosis reactive oxygen species ros polymerase chain reaction for cardiotropic viruses immunohistochemistry for nitrotyrosine inducible nitric oxide synthase inos 8 hydroxydeoxyguanosine 8 oh dg and proteomics have been evaluated in endomyocardial biopsies from 9 patients pts 5 male and 4 female mean age 61 13 years with dbcm left ventricular end diastolic diameter 65 2 3mm ejection fraction 27 6 and type 2 diabetes mellitus and 9 pts with idcm mean age 60 9 years matched for sex age and severity of left ventricular lv dysfunction
Diabetes_Mellitus_other_or_not_specified,24121038,Our results demonstrate that ROS generation in resting granulocytes derived from patients suffering from Type 2 diabetes mellitus (T2DM) is significantly higher than that observed in equivalent cells from healthy controls.,MD,NA,NA,NA,NA,our results demonstrate that ros generation in resting granulocytes derived from patients suffering from type 2 diabetes mellitus t2dm is significantly higher than that observed in equivalent cells from healthy controls
Diabetes_Mellitus_other_or_not_specified,24121038,In conclusion our results suggest that hyperglycemia in diabetes may prime cells metabolically for ROS generation but does not exert any significant effect on TLR-stimulated ROS production and possibly does not aggravate the development of ROS-dependent diabetic complications.,MD,NA,NA,NA,NA,in conclusion our results suggest that hyperglycemia in diabetes may prime cells metabolically for ros generation but does not exert any significant effect on tlr stimulated ros production and possibly does not aggravate the development of ros dependent diabetic complications
Diabetes_Mellitus_other_or_not_specified,11318468,The lack of significant correlation between the degree of microvascular complications in the retina or kidneys and DPOAEs amplitude reduction suggest that the impaired functional properties of the outer hair cells are probably caused by early metabolic complications in diabetes (among other things non-enzymatic glycation related to hyperactivity of free oxygen radicals) and not directly by diabetic microangiopathy.,MD,NA,NA,NA,NA,the lack of significant correlation between the degree of microvascular complications in the retina or kidneys and dpoaes amplitude reduction suggest that the impaired functional properties of the outer hair cells are probably caused by early metabolic complications in diabetes among other things non enzymatic glycation related to hyperactivity of free oxygen radicals and not directly by diabetic microangiopathy
Diabetes_Mellitus_other_or_not_specified,16954821,The interaction of advanced glycation end products (AGE) with their cell surface receptors for AGEs (RAGE) has been causally implicated in the pathogenesis of diabetic vascular complications and has been shown to stimulate cell adhesion molecule expression in endothelial cells via induction of reactive oxygen species (ROS).,MD,NA,NA,NA,NA,the interaction of advanced glycation end products age with their cell surface receptors for ages rage has been causally implicated in the pathogenesis of diabetic vascular complications and has been shown to stimulate cell adhesion molecule expression in endothelial cells via induction of reactive oxygen species ros
Diabetes_Mellitus_other_or_not_specified,18049312,"Advanced glycation end products (AGEs) engagement of a cell-surface receptor for AGEs (RAGE) has been causally implicated in the pathogenesis of diabetic vascular complications via induction of reactive oxygen species (ROS) and subsequent alteration of many gene expressions, including RAGE itself.",MD,NA,NA,NA,NA,advanced glycation end products ages engagement of a cell surface receptor for ages rage has been causally implicated in the pathogenesis of diabetic vascular complications via induction of reactive oxygen species ros and subsequent alteration of many gene expressions including rage itself
Diabetes_Mellitus_other_or_not_specified,25975004,"This study investigated the association of leukocyte telomere length with mitochondrial DNA (mtDNA) copy number, an indicator of mitochondrial density and possible mitochondrial dysfunction, using maternal blood samples collected from women with pregnancies uncomplicated by gestational diabetes or hypertensive disorders.",MD,NA,NA,NA,NA,this study investigated the association of leukocyte telomere length with mitochondrial dna mtdna copy number an indicator of mitochondrial density and possible mitochondrial dysfunction using maternal blood samples collected from women with pregnancies uncomplicated by gestational diabetes or hypertensive disorders
Diabetes_Mellitus_other_or_not_specified,15529632,Production of reactive oxygen species (ROS) increased in diabetic patients and oxidative damage may contribute to the development of diabetic complications.,MD,NA,NA,NA,NA,production of reactive oxygen species ros increased in diabetic patients and oxidative damage may contribute to the development of diabetic complications
Diabetes_Mellitus_other_or_not_specified,21042774,Our results showing S100b/RAGE expression on islets of diabetic rat model and RAGE ligands-induced islet cell apoptosis via NADPH oxidase-mediated ROS generation suggest that RAGE ligands-RAGE interaction may contribute not only to the development of diabetic complications but also to the progressive Î²-cell loss in type 2 diabetes by inducing oxidative stress.,MD,NA,NA,NA,NA,our results showing s100b rage expression on islets of diabetic rat model and rage ligands induced islet cell apoptosis via nadph oxidase mediated ros generation suggest that rage ligands rage interaction may contribute not only to the development of diabetic complications but also to the progressive b cell loss in type 2 diabetes by inducing oxidative stress
Diabetes_Mellitus_other_or_not_specified,23454064,Targeting the upregulation of reactive oxygen species subsequent to hyperglycemia prevents type 1 diabetic cardiomyopathy in mice.,MD,NA,NA,NA,NA,targeting the upregulation of reactive oxygen species subsequent to hyperglycemia prevents type 1 diabetic cardiomyopathy in mice
Diabetes_Mellitus_other_or_not_specified,22555049,Increased formation of reactive oxygen species leading to activation of poly(ADP-ribose) polymerase (PARP)-1 and podocyte loss by apoptosis contribute to albuminuria in diabetes mellitus (DM).,MD,NA,NA,NA,NA,increased formation of reactive oxygen species leading to activation of poly adp ribose polymerase parp 1 and podocyte loss by apoptosis contribute to albuminuria in diabetes mellitus dm
Diabetes_Mellitus_other_or_not_specified,23454064,"In summary, these data suggest that coenzyme Q10 effectively targets LV ROS upregulation to limit type 1 diabetic cardiomyopathy.",MD,NA,NA,NA,NA,in summary these data suggest that coenzyme q10 effectively targets lv ros upregulation to limit type 1 diabetic cardiomyopathy
Diabetes_Mellitus_other_or_not_specified,26415345,The study evaluates the extent of oxidative stress and antioxidant status against ROS in AMI patients and amelioration of oxidative stress after regular treatment and also assesses the association between oxidative stress and risk factors for atherosclerosis like dyslipidemia and diabetes mellitus (DM).,MD,NA,NA,NA,NA,the study evaluates the extent of oxidative stress and antioxidant status against ros in ami patients and amelioration of oxidative stress after regular treatment and also assesses the association between oxidative stress and risk factors for atherosclerosis like dyslipidemia and diabetes mellitus dm
Diabetes_Mellitus_other_or_not_specified,20230940,"Risk factor-associated cavernosal endothelial alterations (diabetes mellitus, hypertension, hypercholesterolemia) are mostly induced by unifying mechanisms, including oxidative stress and accumulation of reactive oxygen species, alteration of NO production, or decrease of VEGF expression.",MD,NA,NA,NA,NA,risk factor associated cavernosal endothelial alterations diabetes mellitus hypertension hypercholesterolemia are mostly induced by unifying mechanisms including oxidative stress and accumulation of reactive oxygen species alteration of no production or decrease of vegf expression
Diabetes_Mellitus_other_or_not_specified,11259653,"Respiratory chain deficiency and cell loss and/or apoptosis have been associated with neurodegeneration, heart failure, diabetes mellitus, and aging.",MD,NA,NA,NA,NA,respiratory chain deficiency and cell loss and or apoptosis have been associated with neurodegeneration heart failure diabetes mellitus and aging
Diabetes_Mellitus_other_or_not_specified,18698138,"There is significant evidence that reactive oxygen species play an important role in endothelial dysfunction, ischemia/reperfusion injury as well as in the pathogenesis of diabetes mellitus (DM).",MD,NA,NA,NA,NA,there is significant evidence that reactive oxygen species play an important role in endothelial dysfunction ischemia reperfusion injury as well as in the pathogenesis of diabetes mellitus dm
Diabetes_Mellitus_other_or_not_specified,18773968,"Type 2 diabetes mellitus (T2DM) is associated with a high production of reactive oxygen species, which may cause oxidative DNA damage.",MD,NA,NA,NA,NA,type 2 diabetes mellitus t2dm is associated with a high production of reactive oxygen species which may cause oxidative dna damage
Diabetes_Mellitus_other_or_not_specified,21748374,There is increasing evidence that mitochondrial dysfunction and oxidative stress may be integral to the pathogenesis of type 2 diabetes mellitus.,MD,NA,NA,NA,NA,there is increasing evidence that mitochondrial dysfunction and oxidative stress may be integral to the pathogenesis of type 2 diabetes mellitus
Diabetes_Mellitus_other_or_not_specified,24474649,The molecular pathway for hyperglycemia-induced mitochondrial dysfunction in platelets in diabetes mellitus is unknown.,MD,NA,NA,NA,NA,the molecular pathway for hyperglycemia induced mitochondrial dysfunction in platelets in diabetes mellitus is unknown
Diabetes_Mellitus_other_or_not_specified,24558030,Recent studies have shown mitochondrial dysfunction and increased production of reactive oxygen species in peripheral blood mononuclear cells (PBMCs) and endothelial cells from patients with diabetes mellitus.,MD,NA,NA,NA,NA,recent studies have shown mitochondrial dysfunction and increased production of reactive oxygen species in peripheral blood mononuclear cells pbmcs and endothelial cells from patients with diabetes mellitus
Diabetes_Mellitus_other_or_not_specified,24928681,"Diabetes mellitus was associated with a pronounced impairment of intrinsic contraction, mitochondrial dysfunction, and increased myocardial oxidative stress, regardless of weight status.",MD,NA,NA,NA,NA,diabetes mellitus was associated with a pronounced impairment of intrinsic contraction mitochondrial dysfunction and increased myocardial oxidative stress regardless of weight status
Diabetes_Mellitus_other_or_not_specified,25420343,Mitochondrial oxidative stress has been reported in models of both type 1 and type 2 diabetes mellitus and may play a central role in mitochondrial dysfunction.,MD,NA,NA,NA,NA,mitochondrial oxidative stress has been reported in models of both type 1 and type 2 diabetes mellitus and may play a central role in mitochondrial dysfunction
Diabetes_Mellitus_other_or_not_specified,25437179,Umbilical cord mesenchymal stromal cells affected by gestational diabetes mellitus display premature aging and mitochondrial dysfunction.,MD,NA,NA,NA,NA,umbilical cord mesenchymal stromal cells affected by gestational diabetes mellitus display premature aging and mitochondrial dysfunction
Diabetes_Mellitus_other_or_not_specified,16945391,Reactive oxygen species damaged human serum albumin in patients with type 1 diabetes mellitus: biochemical and immunological studies.,MD,NA,NA,NA,NA,reactive oxygen species damaged human serum albumin in patients with type 1 diabetes mellitus biochemical and immunological studies
Diabetes_Mellitus_other_or_not_specified,28603900,"Mitochondrial dysfunction is associated with several clinical manifestations including diabetes mellitus (DM), neurological disorders, renal and hepatic diseases, and myopathy.",MD,NA,NA,NA,NA,mitochondrial dysfunction is associated with several clinical manifestations including diabetes mellitus dm neurological disorders renal and hepatic diseases and myopathy
Diabetes_Mellitus_other_or_not_specified,17390150,"The recent observations that Peroxisome proliferator activated receptor gamma coactivator 1 alpha (PGC1A) is responsible for the induction of reactive oxygen species (ROS) detoxifying agents and that ROS triggers insulin resistance, support the role that this gene could play in the onset of Type 2 diabetes mellitus (T2DM).",MD,NA,NA,NA,NA,the recent observations that peroxisome proliferator activated receptor gamma coactivator 1 alpha pgc1a is responsible for the induction of reactive oxygen species ros detoxifying agents and that ros triggers insulin resistance support the role that this gene could play in the onset of type 2 diabetes mellitus t2dm
Diabetes_Mellitus_other_or_not_specified,17188741,"Homocysteine, reactive oxygen species and nitric oxide in type 2 diabetes mellitus.",MD,NA,NA,NA,NA,homocysteine reactive oxygen species and nitric oxide in type 2 diabetes mellitus
Diabetes_Mellitus_other_or_not_specified,14631331,Granulocytes either from healthy subjects or from type II-Non Insulin Dependent Diabetes Mellitus (NIDDM) patients were compared in their capacities to generate Reactive Oxygen Species (ROS).,MD,NA,NA,NA,NA,granulocytes either from healthy subjects or from type ii non insulin dependent diabetes mellitus niddm patients were compared in their capacities to generate reactive oxygen species ros
Diabetes_Mellitus_other_or_not_specified,11942734,"Diabetes mellitus is associated with a high oxidative stress level, resulting from an imbalance between free radicals or reactive oxygen species production and the antioxidant systems.",MD,NA,NA,NA,NA,diabetes mellitus is associated with a high oxidative stress level resulting from an imbalance between free radicals or reactive oxygen species production and the antioxidant systems
Diabetes_Mellitus_other_or_not_specified,27036979,Prior studies demonstrate mitochondrial dysfunction with increased reactive oxygen species generation in peripheral blood mononuclear cells in diabetes mellitus.,MD,NA,NA,NA,NA,prior studies demonstrate mitochondrial dysfunction with increased reactive oxygen species generation in peripheral blood mononuclear cells in diabetes mellitus
Diabetes_Mellitus_other_or_not_specified,7987655,"Two groups of patients with insulin-dependent diabetes mellitus of > 10 years duration and either persistent normoalbuminuria (group 1, n = 49; albumin excretion < 30 mg/day) or microalbuminuria (group 2, n = 33; albumin excretion 30-300 mg/day) were investigated for evidence of free oxygen radical activity (erythrocytic superoxide dismutase and glutathione peroxidase) and oxidant injury (serum malondialdehyde).",MD,NA,NA,NA,NA,two groups of patients with insulin dependent diabetes mellitus of 10 years duration and either persistent normoalbuminuria group 1 n 49 albumin excretion 30 mg day or microalbuminuria group 2 n 33 albumin excretion 30 300 mg day were investigated for evidence of free oxygen radical activity erythrocytic superoxide dismutase and glutathione peroxidase and oxidant injury serum malondialdehyde
Diabetes_Mellitus_other_or_not_specified,19604518,The aim of the study was to evaluate the levels of free oxygen radicals and free oxygen radicals defense in patients with newly diagnosed type 2 diabetes mellitus (T2DM).,MD,NA,NA,NA,NA,the aim of the study was to evaluate the levels of free oxygen radicals and free oxygen radicals defense in patients with newly diagnosed type 2 diabetes mellitus t2dm
Diabetes_Mellitus_other_or_not_specified,10668920,"Diabetes mellitus is associated with increased generation of free oxygen radicals and depleted scavenging potential (oxidative stress), leading to increased LDL oxidation and platelet hyperreactivity, the major components of atherothrombotic vascular lesions.",MD,NA,NA,NA,NA,diabetes mellitus is associated with increased generation of free oxygen radicals and depleted scavenging potential oxidative stress leading to increased ldl oxidation and platelet hyperreactivity the major components of atherothrombotic vascular lesions
Diabetes_Mellitus_other_or_not_specified,12739426,It could be suggested that type 2 diabetes mellitus in patients with HCV-related chronic liver disease could be facilitated by hepatic iron overload and mitochondrial damage.,MD,NA,NA,NA,NA,it could be suggested that type 2 diabetes mellitus in patients with hcv related chronic liver disease could be facilitated by hepatic iron overload and mitochondrial damage
Diabetes_Mellitus_other_or_not_specified,9646944,Chronic production of reactive oxygen species (ROS) and/or deficiency in the antioxidant defense system are observed in non-insulin-dependent diabetes mellitus (NIDDM) patients.,MD,NA,NA,NA,NA,chronic production of reactive oxygen species ros and or deficiency in the antioxidant defense system are observed in non insulin dependent diabetes mellitus niddm patients
Diabetic_Eye_Disease,19088495,"Hence, it should be feasible to carry out clinical trials with this compound aimed at treating diseases such as cataracts and diabetic retinopathy induced by generation of reactive oxygen species and consequent oxidative stress.",MD,1,0,0,0,hence it should be feasible to carry out clinical trials with this compound aimed at treating diseases such as cataracts and diabetic retinopathy induced by generation of reactive oxygen species and consequent oxidative stress
Diabetic_Eye_Disease,23633659,Increase in reactive oxygen species (ROS) is one of the major retinal metabolic abnormalities associated with the development of diabetic retinopathy.,MD,1,0,0,0,increase in reactive oxygen species ros is one of the major retinal metabolic abnormalities associated with the development of diabetic retinopathy
Diabetic_Eye_Disease,23150372,"Mitochondrial dysfunction and genomic instability are associated with a number of retinal pathologies including age-related macular degeneration, diabetic retinopathy, and glaucoma.",MD,1,0,0,0,mitochondrial dysfunction and genomic instability are associated with a number of retinal pathologies including age related macular degeneration diabetic retinopathy and glaucoma
Diabetic_Eye_Disease,21911054,Mitochondrial biogenesis and the development of diabetic retinopathy.,MD,NA,NA,NA,NA,mitochondrial biogenesis and the development of diabetic retinopathy
Diabetic_Eye_Disease,25686055,The aim was to evaluate circulating levels of reactive oxygen species (ROS) and changes in central macular thickness (CMT) in patients with nonproliferative diabetic retinopathy (NPDR) after antioxidant supplementation.,MD,NA,NA,NA,NA,the aim was to evaluate circulating levels of reactive oxygen species ros and changes in central macular thickness cmt in patients with nonproliferative diabetic retinopathy npdr after antioxidant supplementation
Diabetic_Eye_Disease,25686055,Circulating levels of reactive oxygen species in patients with nonproliferative diabetic retinopathy and the influence of antioxidant supplementation: 6-month follow-up.,MD,NA,NA,NA,NA,circulating levels of reactive oxygen species in patients with nonproliferative diabetic retinopathy and the influence of antioxidant supplementation 6 month follow up
Diabetic_Eye_Disease,18177940,To investigate vitreous levels of reactive oxygen species (ROS) in patients with proliferative diabetic retinopathy (PDR) and analyze ROS levels among different groups of PDR patients.,MD,NA,NA,NA,NA,to investigate vitreous levels of reactive oxygen species ros in patients with proliferative diabetic retinopathy pdr and analyze ros levels among different groups of pdr patients
Diabetic_Eye_Disease,26599598,"Thus, in diabetes, due to Sirt1 inhibition, AP-1 is hyperacetylated, which increases its binding at MMP-9 promoter, and hence, activation of Sirt1 could inhibit the development of diabetic retinopathy by impeding MMP-9-mediated mitochondrial damage.",MD,NA,NA,NA,NA,thus in diabetes due to sirt1 inhibition ap 1 is hyperacetylated which increases its binding at mmp 9 promoter and hence activation of sirt1 could inhibit the development of diabetic retinopathy by impeding mmp 9 mediated mitochondrial damage
Diabetic_Eye_Disease,8886588,These results suggest that reactive oxygen species produced by PMNs may play a role in the progression of diabetic retinopathy.,MD,NA,NA,NA,NA,these results suggest that reactive oxygen species produced by pmns may play a role in the progression of diabetic retinopathy
Diabetic_Eye_Disease,24554007,"RAC1 and NOX2 activation, ROS generation, mitochondrial damage and cell apoptosis were quantified in bovine retinal endothelial cells exposed to high glucose concentrations, in the retina from normal and streptozotocin-induced diabetic rats and mice, and the retina from human donors with diabetic retinopathy.",MD,NA,NA,NA,NA,rac1 and nox2 activation ros generation mitochondrial damage and cell apoptosis were quantified in bovine retinal endothelial cells exposed to high glucose concentrations in the retina from normal and streptozotocin induced diabetic rats and mice and the retina from human donors with diabetic retinopathy
